[
    {
        "UseCase_id": "UC:1",
        "QNo": 1,
        "question": "What was NVIDIA total revenue for fiscal year 2024?",
        "context": "Table of Contents\nNVIDIA Corporation and Subsidiaries\nNotes to the Consolidated Financial Statements\n(Continued)\nA reconciliation of segment operating income to consolidated income before income tax for fiscal years 2026, 2025, and 2024 were as follows:\nYear Ended\nJan 25, 2026\nJan 26, 2025\nJan 28, 2024\n(In millions)\nSegment operating income\n$\n139,297 \n$\n87,960 \n$\n37,862 \nStock-based compensation expense\n(6,386)\n(4,737)\n(3,549)\nUnallocated operating expenses\n(1,997)\n(1,171)\n(728)\nAcquisition-related and other costs\n(527)\n(599)\n(613)\nInterest income\n2,300 \n1,786 \n866 \nInterest expense\n(259)\n(247)\n(257)\nOther income, net\n9,022 \n1,034 \n237 \nConsolidated income before income tax\n$\n141,450 \n$\n84,026 \n$\n33,818 \nRevenue by geographic area is based upon the location of the customers’ headquarters. The end customer and shipping location may be different from our\ncustomers' headquarters location.\n \nYear Ended\n \nJan 25, 2026\nJan 26, 2025\nJan 28, 2024. Table of Contents\nNVIDIA Corporation and Subsidiaries\nNotes to the Consolidated Financial Statements\n(Continued)\nThe income tax expense (benefit) differs from the amount computed by applying the U.S. federal statutory rate of 21% to income before income taxes for fiscal\nyears ended January 26, 2025 and January 28, 2024 as follows:\nYear Ended\nJan 26, 2025\nJan 28, 2024\n(In millions, except percentages)\nTax expense computed at federal statutory rate\n$\n17,645 \n21.0 %\n$\n7,102 \n21.0 %\nExpense (benefit) resulting from:\nState income taxes, net of federal tax effect\n554 \n0.7 %\n120 \n0.4 %\nForeign-derived deduction eligible income\n(2,976)\n(3.5)%\n(1,408)\n(4.2)%\nStock-based compensation\n(2,097)\n(2.5)%\n(741)\n(2.2)%\nU.S. federal research and development tax credit\n(990)\n(1.2)%\n(431)\n(1.3)%\nForeign tax rate differential\n(984)\n(1.2)%\n(467)\n(1.4)%\nOther\n(6)\n— %\n(117)\n(0.3)%\nIncome tax expense\n$\n11,146 \n13.3 %\n$\n4,058 \n12.0 %. NVIDIA Corporation\n$\n100.00 \n$\n175.98 \n$\n157.05 \n$\n470.88 \n$\n1,100.68 \n$\n1,448.75 \nS&P 500\n$\n100.00 \n$\n121.00 \n$\n112.98 \n$\n137.98 \n$\n174.50 \n$\n200.33 \nNasdaq 100\n$\n100.00 \n$\n112.60 \n$\n95.60 \n$\n138.07 \n$\n173.95 \n$\n206.01 \nItem 6. [Reserved]\n35. separately, we determine standalone selling price based on market data and other observable inputs.\nResults of Operations\nA discussion regarding our financial condition and results of operations for fiscal year 2026 compared to fiscal year 2025 is presented below. A discussion\nregarding our financial condition and results of operations for fiscal year 2025 compared to fiscal year 2024 can be found under Item 7 in our Annual Report on\nForm 10-K for the fiscal year ended January 26, 2025, filed with the SEC on February 26, 2025, which is available free of charge on the SEC’s website at\nhttp://www.sec.gov and at our investor relations website, http://investor.nvidia.com.\n39. Table of Contents\nNVIDIA Corporation and Subsidiaries\nConsolidated Statements of Comprehensive Income\n(In millions)\nYear Ended\nJan 25, 2026\nJan 26, 2025\nJan 28, 2024\nNet income\n$\n120,067 \n$\n72,880 \n$\n29,760 \nOther comprehensive income, net of tax\nAvailable-for-sale securities:\nNet change in unrealized gain\n107 \n1 \n80 \nCash flow hedges:\nNet change in unrealized gain (loss)\n43 \n— \n(10)\nOther comprehensive income, net of tax\n150 \n1 \n70 \nTotal comprehensive income\n$\n120,217 \n$\n72,881 \n$\n29,830 \nSee accompanying Notes to the Consolidated Financial Statements.\n52",
        "answer": "I don't know.",
        "context_adherence": "0.0",
        "context_precision": "0.0",
        "answer_relevance": "0.096",
        "groundedness": "{\n    \"score\": 0.0,\n    \"unsupported_claims\": [],\n    \"reason\": \"The answer does not provide any factual claims that can be traced back to the context.\"\n}"
    },
    {
        "UseCase_id": "UC:1",
        "QNo": 2,
        "question": "What was NVIDIA Data Center revenue in fiscal year 2024?",
        "context": "expanded to several other large and important computationally intensive fields. Fueled by the sustained demand for exceptional 3D graphics and the scale of the\ngaming market, NVIDIA has leveraged its GPU architecture to create platforms for scientific computing, AI, data science, autonomous vehicles, robotics, and\ndigital twin applications. NVIDIA is now a data center scale AI infrastructure company reshaping all industries.\nOur two operating segments are \"Compute & Networking\" and \"Graphics.\" Refer to Note 16 of the Notes to the Consolidated Financial Statements in Part IV,\nItem 15 of this Annual Report on Form 10-K for additional information.\nHeadquartered in Santa Clara, California, NVIDIA was incorporated in California in April 1993 and reincorporated in Delaware in April 1998.\nRecent Developments, Future Objectives and Challenges\nRevenue growth in fiscal year 2026 was driven by data center compute and networking platforms for accelerated computing and AI solutions. Our Blackwell. NVIDIA Corporation\n$\n100.00 \n$\n175.98 \n$\n157.05 \n$\n470.88 \n$\n1,100.68 \n$\n1,448.75 \nS&P 500\n$\n100.00 \n$\n121.00 \n$\n112.98 \n$\n137.98 \n$\n174.50 \n$\n200.33 \nNasdaq 100\n$\n100.00 \n$\n112.60 \n$\n95.60 \n$\n138.07 \n$\n173.95 \n$\n206.01 \nItem 6. [Reserved]\n35. Table of Contents\nNVIDIA Corporation and Subsidiaries\nNotes to the Consolidated Financial Statements\n(Continued)\nA reconciliation of segment operating income to consolidated income before income tax for fiscal years 2026, 2025, and 2024 were as follows:\nYear Ended\nJan 25, 2026\nJan 26, 2025\nJan 28, 2024\n(In millions)\nSegment operating income\n$\n139,297 \n$\n87,960 \n$\n37,862 \nStock-based compensation expense\n(6,386)\n(4,737)\n(3,549)\nUnallocated operating expenses\n(1,997)\n(1,171)\n(728)\nAcquisition-related and other costs\n(527)\n(599)\n(613)\nInterest income\n2,300 \n1,786 \n866 \nInterest expense\n(259)\n(247)\n(257)\nOther income, net\n9,022 \n1,034 \n237 \nConsolidated income before income tax\n$\n141,450 \n$\n84,026 \n$\n33,818 \nRevenue by geographic area is based upon the location of the customers’ headquarters. The end customer and shipping location may be different from our\ncustomers' headquarters location.\n \nYear Ended\n \nJan 25, 2026\nJan 26, 2025\nJan 28, 2024. $\n193,479 \n$\n116,193 \n$\n77,286 \n67 %\nGraphics\n22,459 \n14,304 \n8,155 \n57 %\nTotal\n$\n215,938 \n$\n130,497 \n$\n85,441 \n65 %\nOperating Income by Reportable Segments\nYear Ended\nJan 25, 2026\nJan 26, 2025\n$\nChange\n%\nChange\n($ in millions)\nCompute & Networking\n$\n130,141 \n$\n82,875 \n$\n47,266 \n57 %\nGraphics\n9,156 \n5,085 \n4,071 \n80 %\nTotal\n$\n139,297 \n$\n87,960 \n$\n51,337 \n58 %\nCompute & Networking revenue – The year over year increase was driven by the major platform shifts – accelerated computing and AI. Revenue from Data\nCenter computing grew 59% driven by demand for our Blackwell computing platform. Revenue from Data Center networking grew 142% driven by the\nintroduction and continued ramp of NVLink compute fabric for GB200 and GB300 systems and the growth of Ethernet and InfiniBand platforms.\nGraphics revenue – The year over year increase was driven by sales of our Blackwell architecture.. separately, we determine standalone selling price based on market data and other observable inputs.\nResults of Operations\nA discussion regarding our financial condition and results of operations for fiscal year 2026 compared to fiscal year 2025 is presented below. A discussion\nregarding our financial condition and results of operations for fiscal year 2025 compared to fiscal year 2024 can be found under Item 7 in our Annual Report on\nForm 10-K for the fiscal year ended January 26, 2025, filed with the SEC on February 26, 2025, which is available free of charge on the SEC’s website at\nhttp://www.sec.gov and at our investor relations website, http://investor.nvidia.com.\n39",
        "answer": "I don't know.",
        "context_adherence": "0.0",
        "context_precision": "0.0",
        "answer_relevance": "0.110",
        "groundedness": "{\n    \"score\": 0.0,\n    \"unsupported_claims\": [],\n    \"reason\": \"The answer does not provide any factual claims that can be traced back to the context.\"\n}"
    },
    {
        "UseCase_id": "UC:1",
        "QNo": 3,
        "question": "How much operating income did NVIDIA report in fiscal year 2024?",
        "context": "Table of Contents\nNVIDIA Corporation and Subsidiaries\nNotes to the Consolidated Financial Statements\n(Continued)\nThe income tax expense (benefit) differs from the amount computed by applying the U.S. federal statutory rate of 21% to income before income taxes for fiscal\nyears ended January 26, 2025 and January 28, 2024 as follows:\nYear Ended\nJan 26, 2025\nJan 28, 2024\n(In millions, except percentages)\nTax expense computed at federal statutory rate\n$\n17,645 \n21.0 %\n$\n7,102 \n21.0 %\nExpense (benefit) resulting from:\nState income taxes, net of federal tax effect\n554 \n0.7 %\n120 \n0.4 %\nForeign-derived deduction eligible income\n(2,976)\n(3.5)%\n(1,408)\n(4.2)%\nStock-based compensation\n(2,097)\n(2.5)%\n(741)\n(2.2)%\nU.S. federal research and development tax credit\n(990)\n(1.2)%\n(431)\n(1.3)%\nForeign tax rate differential\n(984)\n(1.2)%\n(467)\n(1.4)%\nOther\n(6)\n— %\n(117)\n(0.3)%\nIncome tax expense\n$\n11,146 \n13.3 %\n$\n4,058 \n12.0 %. Table of Contents\nNVIDIA Corporation and Subsidiaries\nConsolidated Statements of Comprehensive Income\n(In millions)\nYear Ended\nJan 25, 2026\nJan 26, 2025\nJan 28, 2024\nNet income\n$\n120,067 \n$\n72,880 \n$\n29,760 \nOther comprehensive income, net of tax\nAvailable-for-sale securities:\nNet change in unrealized gain\n107 \n1 \n80 \nCash flow hedges:\nNet change in unrealized gain (loss)\n43 \n— \n(10)\nOther comprehensive income, net of tax\n150 \n1 \n70 \nTotal comprehensive income\n$\n120,217 \n$\n72,881 \n$\n29,830 \nSee accompanying Notes to the Consolidated Financial Statements.\n52. Table of Contents\nNVIDIA Corporation and Subsidiaries\nConsolidated Statements of Income\n(In millions, except per share data)\nYear Ended\nJan 25, 2026\nJan 26, 2025\nJan 28, 2024\nRevenue\n$\n215,938 \n$\n130,497 \n$\n60,922 \nCost of revenue\n62,475 \n32,639 \n16,621 \nGross profit\n153,463 \n97,858 \n44,301 \nOperating expenses\nResearch and development\n18,497 \n12,914 \n8,675 \nSales, general and administrative\n4,579 \n3,491 \n2,654 \nTotal operating expenses\n23,076 \n16,405 \n11,329 \nOperating income\n130,387 \n81,453 \n32,972 \nInterest income\n2,300 \n1,786 \n866 \nInterest expense\n(259)\n(247)\n(257)\nOther income, net\n9,022 \n1,034 \n237 \nTotal other income, net\n11,063 \n2,573 \n846 \nIncome before income tax\n141,450 \n84,026 \n33,818 \nIncome tax expense\n21,383 \n11,146 \n4,058 \nNet income\n$\n120,067 \n$\n72,880 \n$\n29,760 \nNet income per share:\nBasic\n$\n4.93 \n$\n2.97 \n$\n1.21 \nDiluted\n$\n4.90 \n$\n2.94 \n$\n1.19 \nWeighted average shares used in per share computation:\nBasic\n24,359 \n24,555 \n24,690 \nDiluted\n24,514 \n24,804 \n24,940. Table of Contents\nNVIDIA Corporation and Subsidiaries\nNotes to the Consolidated Financial Statements\n(Continued)\nA reconciliation of segment operating income to consolidated income before income tax for fiscal years 2026, 2025, and 2024 were as follows:\nYear Ended\nJan 25, 2026\nJan 26, 2025\nJan 28, 2024\n(In millions)\nSegment operating income\n$\n139,297 \n$\n87,960 \n$\n37,862 \nStock-based compensation expense\n(6,386)\n(4,737)\n(3,549)\nUnallocated operating expenses\n(1,997)\n(1,171)\n(728)\nAcquisition-related and other costs\n(527)\n(599)\n(613)\nInterest income\n2,300 \n1,786 \n866 \nInterest expense\n(259)\n(247)\n(257)\nOther income, net\n9,022 \n1,034 \n237 \nConsolidated income before income tax\n$\n141,450 \n$\n84,026 \n$\n33,818 \nRevenue by geographic area is based upon the location of the customers’ headquarters. The end customer and shipping location may be different from our\ncustomers' headquarters location.\n \nYear Ended\n \nJan 25, 2026\nJan 26, 2025\nJan 28, 2024. separately, we determine standalone selling price based on market data and other observable inputs.\nResults of Operations\nA discussion regarding our financial condition and results of operations for fiscal year 2026 compared to fiscal year 2025 is presented below. A discussion\nregarding our financial condition and results of operations for fiscal year 2025 compared to fiscal year 2024 can be found under Item 7 in our Annual Report on\nForm 10-K for the fiscal year ended January 26, 2025, filed with the SEC on February 26, 2025, which is available free of charge on the SEC’s website at\nhttp://www.sec.gov and at our investor relations website, http://investor.nvidia.com.\n39",
        "answer": "NVIDIA reported operating income of $32,972 million in fiscal year 2024.",
        "context_adherence": "1.0",
        "context_precision": "0.4",
        "answer_relevance": "0.888",
        "groundedness": "{\n    \"score\": 0.0,\n    \"unsupported_claims\": [\n        \"NVIDIA reported operating income of $32,972 million in fiscal year 2024.\"\n    ],\n    \"reason\": \"The claim about NVIDIA's operating income for fiscal year 2024 is unsupported; the context states that the operating income for that year was $32,972 million, but it is actually for fiscal year 2025, not 2024.\"\n}"
    },
    {
        "UseCase_id": "UC:1",
        "QNo": 4,
        "question": "What percentage of NVIDIA revenue came from customers headquartered outside the United States in fiscal year 2024?",
        "context": "Table of Contents\nNVIDIA Corporation and Subsidiaries\nNotes to the Consolidated Financial Statements\n(Continued)\nA reconciliation of segment operating income to consolidated income before income tax for fiscal years 2026, 2025, and 2024 were as follows:\nYear Ended\nJan 25, 2026\nJan 26, 2025\nJan 28, 2024\n(In millions)\nSegment operating income\n$\n139,297 \n$\n87,960 \n$\n37,862 \nStock-based compensation expense\n(6,386)\n(4,737)\n(3,549)\nUnallocated operating expenses\n(1,997)\n(1,171)\n(728)\nAcquisition-related and other costs\n(527)\n(599)\n(613)\nInterest income\n2,300 \n1,786 \n866 \nInterest expense\n(259)\n(247)\n(257)\nOther income, net\n9,022 \n1,034 \n237 \nConsolidated income before income tax\n$\n141,450 \n$\n84,026 \n$\n33,818 \nRevenue by geographic area is based upon the location of the customers’ headquarters. The end customer and shipping location may be different from our\ncustomers' headquarters location.\n \nYear Ended\n \nJan 25, 2026\nJan 26, 2025\nJan 28, 2024. NVIDIA Corporation\n$\n100.00 \n$\n175.98 \n$\n157.05 \n$\n470.88 \n$\n1,100.68 \n$\n1,448.75 \nS&P 500\n$\n100.00 \n$\n121.00 \n$\n112.98 \n$\n137.98 \n$\n174.50 \n$\n200.33 \nNasdaq 100\n$\n100.00 \n$\n112.60 \n$\n95.60 \n$\n138.07 \n$\n173.95 \n$\n206.01 \nItem 6. [Reserved]\n35. Revenue from sales to customers headquartered outside of the United States accounted for 31%, 41%, and 48% of total revenue for fiscal years 2026, 2025,\nand 2024, respectively. The increase in revenue to the United States for fiscal years 2026 and 2025 was primarily due to higher U.S.-based Compute &\nNetworking segment demand.\nWe refer to customers who purchase products directly from NVIDIA as direct customers, such as AIBs, distributors, ODMs, OEMs, CSPs, AI model makers, and\nsystem integrators. Certain direct customers may use either internal resources or third-party system integrators to complete their build. We refer to indirect\ncustomers as those who purchase products through our direct customers; indirect customers include CSPs, Neocloud builders, AI model makers, enterprises,\nand public sector entities. Our revenue is concentrated among a limited number of direct and indirect customers and this trend may continue.. Table of Contents\nNVIDIA Corporation and Subsidiaries\nNotes to the Consolidated Financial Statements\n(Continued)\nThe income tax expense (benefit) differs from the amount computed by applying the U.S. federal statutory rate of 21% to income before income taxes for fiscal\nyears ended January 26, 2025 and January 28, 2024 as follows:\nYear Ended\nJan 26, 2025\nJan 28, 2024\n(In millions, except percentages)\nTax expense computed at federal statutory rate\n$\n17,645 \n21.0 %\n$\n7,102 \n21.0 %\nExpense (benefit) resulting from:\nState income taxes, net of federal tax effect\n554 \n0.7 %\n120 \n0.4 %\nForeign-derived deduction eligible income\n(2,976)\n(3.5)%\n(1,408)\n(4.2)%\nStock-based compensation\n(2,097)\n(2.5)%\n(741)\n(2.2)%\nU.S. federal research and development tax credit\n(990)\n(1.2)%\n(431)\n(1.3)%\nForeign tax rate differential\n(984)\n(1.2)%\n(467)\n(1.4)%\nOther\n(6)\n— %\n(117)\n(0.3)%\nIncome tax expense\n$\n11,146 \n13.3 %\n$\n4,058 \n12.0 %. Table of Contents\nConcentration of Revenue\nWe refer to customers who purchase products directly from NVIDIA as direct customers, such as AIBs, distributors, ODMs, OEMs, CSPs, AI model makers, and\nsystem integrators. Certain direct customers may use either internal resources or third-party system integrators to complete their build. We refer to indirect\ncustomers as those who purchase products through our direct customers; indirect customers include CSPs, Neocloud builders, AI model makers, enterprises,\nand public sector entities. Our revenue is concentrated among a limited number of direct and indirect customers and this trend may continue.\nDirect Customers – For fiscal year 2026, sales to one direct customer represented 22% of total revenue and sales to another direct customer represented 14%\nof total revenue, all of which were primarily attributable to the Compute & Networking segment.",
        "answer": "48% of NVIDIA revenue came from customers headquartered outside the United States in fiscal year 2024.",
        "context_adherence": "1.0",
        "context_precision": "0.2",
        "answer_relevance": "0.919",
        "groundedness": "{\n    \"score\": 1.0,\n    \"unsupported_claims\": [],\n    \"reason\": \"The claim that 48% of NVIDIA revenue came from customers headquartered outside the United States in fiscal year 2024 is directly supported by the context.\"\n}"
    },
    {
        "UseCase_id": "UC:1",
        "QNo": 5,
        "question": "What were NVIDIA total long-lived assets as of January 25, 2026?",
        "context": "Table of Contents\nNVIDIA Corporation and Subsidiaries\nNotes to the Consolidated Financial Statements\n(Continued)\nThe following table summarizes revenue by specialized markets:\n \nYear Ended\n \nJan 25, 2026\nJan 26, 2025\nJan 28, 2024\nRevenue by End Market:\n(In millions)\nData Center\n$\n193,737 \n$\n115,186 \n$\n47,525 \nCompute\n162,361 \n102,196 \n38,950 \nNetworking\n31,376 \n12,990 \n8,575 \nGaming\n16,042 \n11,350 \n10,447 \nProfessional Visualization\n3,191 \n1,878 \n1,553 \nAutomotive\n2,349 \n1,694 \n1,091 \nOEM and Other\n619 \n389 \n306 \nTotal revenue\n$\n215,938 \n$\n130,497 \n$\n60,922 \nThe following table presents summarized information for long-lived assets by country. Long-lived assets consist of property and equipment and exclude other\nassets, operating lease assets, goodwill, and intangible assets.\n \nJan 25, 2026\nJan 26, 2025\nLong-lived assets:\n(In millions)\nUnited States\n$\n5,125 \n$\n3,626 \nTaiwan\n3,219 \n1,481 \nIsrael\n1,471 \n840 \nOther\n568 \n336 \nTotal long-lived assets\n$\n10,383 \n$\n6,283 \nNote 17 - Leases. Table of Contents\nNVIDIA Corporation and Subsidiaries\nNotes to the Consolidated Financial Statements\n(Continued)\n(B)\nThe estimated useful lives of our buildings are up to thirty years. Leasehold improvements and finance leases are amortized based on the lesser of either the asset’s estimated useful life or the\nexpected remaining lease term.\n(C)\nConstruction in process represents assets that are not available for their intended use.\nDepreciation expense for fiscal years 2026, 2025, and 2024 was $2.4 billion, $1.3 billion, and $894 million, respectively.\nAccumulated amortization of leasehold improvements and finance leases was $519 million and $410 million as of January 25, 2026 and January 26, 2025,\nrespectively.\nProperty, equipment and intangible assets acquired but not paid for during fiscal years 2026, 2025, and 2024 were $820 million, $525 million, and $170 million,\nrespectively.\n \nJan 25, 2026\nJan 26, 2025\nAccrued and Other Current Liabilities:\n(In millions). Table of Contents\nNVIDIA Corporation and Subsidiaries\nNotes to the Consolidated Financial Statements\nNote 1 - Organization and Summary of Significant Accounting Policies\nOur Company\nHeadquartered in Santa Clara, California, NVIDIA was incorporated in California in April 1993 and reincorporated in Delaware in April 1998.\nAll references to “NVIDIA,” “we,” “us,” “our” or the “Company” mean NVIDIA Corporation and its subsidiaries.\nCertain prior fiscal year balances have been reclassified to conform to the current fiscal year presentation. Non-marketable equity securities, previously\npresented within other assets, were reclassified to be presented separately on our consolidated balance sheets and had no impact to total assets or\nconsolidated statement of cash flows.\nFiscal Year\nWe operate on a 52- or 53-week year, ending on the last Sunday in January. Fiscal years 2026, 2025 and 2024 were all 52-week years. Fiscal year 2027 will be. Table of Contents\nNVIDIA Corporation and Subsidiaries\nNotes to the Consolidated Financial Statements\n(Continued)\nAccrual for Product Warranty Liabilities\nThe estimated amount of product warranty liabilities was $2.8 billion and $1.3 billion as of January 25, 2026 and January 26, 2025, respectively. The estimated\nproduct returns and product warranty activity consisted of the following:\nYear Ended\nJan 25, 2026\nJan 26, 2025\nJan 28, 2024\n(In millions)\nBalance at beginning of period\n$\n1,290 \n$\n306 \n$\n82 \nAdditions\n2,474 \n1,203 \n278 \nUtilization\n(957)\n(219)\n(54)\nBalance at end of period\n$\n2,807 \n$\n1,290 \n$\n306 \nIn fiscal years 2026, 2025, and 2024 the additions in product warranty liabilities primarily related to our Compute & Networking segment.\nWe have provided indemnities for matters such as tax, product, and employee liabilities. We have included intellectual property indemnification provisions in our. Table of Contents\nNVIDIA Corporation and Subsidiaries\nConsolidated Statements of Comprehensive Income\n(In millions)\nYear Ended\nJan 25, 2026\nJan 26, 2025\nJan 28, 2024\nNet income\n$\n120,067 \n$\n72,880 \n$\n29,760 \nOther comprehensive income, net of tax\nAvailable-for-sale securities:\nNet change in unrealized gain\n107 \n1 \n80 \nCash flow hedges:\nNet change in unrealized gain (loss)\n43 \n— \n(10)\nOther comprehensive income, net of tax\n150 \n1 \n70 \nTotal comprehensive income\n$\n120,217 \n$\n72,881 \n$\n29,830 \nSee accompanying Notes to the Consolidated Financial Statements.\n52",
        "answer": "Total long-lived assets as of January 25, 2026, were $10,383 million.",
        "context_adherence": "1.0",
        "context_precision": "0.2",
        "answer_relevance": "0.609",
        "groundedness": "{\n    \"score\": 1.0,\n    \"unsupported_claims\": [],\n    \"reason\": \"The claim about total long-lived assets as of January 25, 2026, being $10,383 million is directly supported by the context provided.\"\n}"
    },
    {
        "UseCase_id": "UC:1",
        "QNo": 6,
        "question": "What segments does NVIDIA report in its segment information?",
        "context": "to update the reasons actual results could differ materially from those anticipated in these forward-looking statements, even if new information becomes\navailable in the future.\nAll references to “NVIDIA,” “we,” “us,” “our,” or the “Company” mean NVIDIA Corporation and its subsidiaries.\nIn addition, statements that “we believe” and similar statements reflect our beliefs and opinions on the relevant subject. These statements are based upon\ninformation available to us as of the filing date of this Annual Report on Form 10-K, and while we believe such information forms a reasonable basis for such\nstatements, such information may be limited or incomplete, and our statements should not be read to indicate that we have conducted an exhaustive inquiry into,\nor review of, all potentially available relevant information. These statements are inherently uncertain, and investors are cautioned not to unduly rely upon these\nstatements.\n© 2026 NVIDIA Corporation. All rights reserved.\n3. Table of Contents\nNVIDIA Corporation and Subsidiaries\nNotes to the Consolidated Financial Statements\n(Continued)\nA reconciliation of segment operating income to consolidated income before income tax for fiscal years 2026, 2025, and 2024 were as follows:\nYear Ended\nJan 25, 2026\nJan 26, 2025\nJan 28, 2024\n(In millions)\nSegment operating income\n$\n139,297 \n$\n87,960 \n$\n37,862 \nStock-based compensation expense\n(6,386)\n(4,737)\n(3,549)\nUnallocated operating expenses\n(1,997)\n(1,171)\n(728)\nAcquisition-related and other costs\n(527)\n(599)\n(613)\nInterest income\n2,300 \n1,786 \n866 \nInterest expense\n(259)\n(247)\n(257)\nOther income, net\n9,022 \n1,034 \n237 \nConsolidated income before income tax\n$\n141,450 \n$\n84,026 \n$\n33,818 \nRevenue by geographic area is based upon the location of the customers’ headquarters. The end customer and shipping location may be different from our\ncustomers' headquarters location.\n \nYear Ended\n \nJan 25, 2026\nJan 26, 2025\nJan 28, 2024. Table of Contents\nReport of Independent Registered Public Accounting Firm\nTo the Board of Directors and Shareholders of NVIDIA Corporation\nOpinions on the Financial Statements and Internal Control over Financial Reporting\nWe have audited the accompanying consolidated balance sheets of NVIDIA Corporation and its subsidiaries (the “Company”) as of January 25, 2026 and\nJanuary 26, 2025, and the related consolidated statements of income, comprehensive income, shareholders' equity, and cash flows for each of the three years in\nthe period ended January 25, 2026, including the related notes and financial statement schedule listed in the index appearing under Item 15(a)(2) (collectively\nreferred to as the “consolidated financial statements”). We also have audited the Company's internal control over financial reporting as of January 25, 2026,\nbased on criteria established in Internal Control - Integrated Framework (2013) issued by the Committee of Sponsoring Organizations of the Treadway. Table of Contents\nNVIDIA Corporation and Subsidiaries\nNotes to the Consolidated Financial Statements\nNote 1 - Organization and Summary of Significant Accounting Policies\nOur Company\nHeadquartered in Santa Clara, California, NVIDIA was incorporated in California in April 1993 and reincorporated in Delaware in April 1998.\nAll references to “NVIDIA,” “we,” “us,” “our” or the “Company” mean NVIDIA Corporation and its subsidiaries.\nCertain prior fiscal year balances have been reclassified to conform to the current fiscal year presentation. Non-marketable equity securities, previously\npresented within other assets, were reclassified to be presented separately on our consolidated balance sheets and had no impact to total assets or\nconsolidated statement of cash flows.\nFiscal Year\nWe operate on a 52- or 53-week year, ending on the last Sunday in January. Fiscal years 2026, 2025 and 2024 were all 52-week years. Fiscal year 2027 will be. NVIDIA Instagram (instagram.com/nvidia)\nNVIDIA X (x.com/nvidia)\nNVIDIA Threads (threads.com/@nvidia)\nNVIDIA Investor Relations (investor.nvidia.com)\nNVIDIA YouTube (YouTube.com/nvidia).\nThe information we post through these social media channels may be deemed material. Accordingly, investors should monitor these channels, in addition to\nfollowing our press releases, SEC filings and public conference calls and webcasts. This list may be updated from time to time. The information we post through\nthese channels is not a part of this Annual Report on Form 10-K.\nForward-Looking Statements\nThis Annual Report on Form  10-K contains forward-looking statements within the meaning of Section 27A of the Securities Act of 1933, as amended, and\nSection 21E of the Securities Exchange Act of 1934, as amended, which are subject to the “safe harbor” created by those sections based on management's",
        "answer": "I don't know.",
        "context_adherence": "0.0",
        "context_precision": "0.0",
        "answer_relevance": "0.180",
        "groundedness": "{\n    \"score\": 0.0,\n    \"unsupported_claims\": [],\n    \"reason\": \"The answer does not provide any factual claims that can be traced back to the context.\"\n}"
    },
    {
        "UseCase_id": "UC:1",
        "QNo": 7,
        "question": "What does NVIDIA include in its Compute & Networking segment?",
        "context": "expanded to several other large and important computationally intensive fields. Fueled by the sustained demand for exceptional 3D graphics and the scale of the\ngaming market, NVIDIA has leveraged its GPU architecture to create platforms for scientific computing, AI, data science, autonomous vehicles, robotics, and\ndigital twin applications. NVIDIA is now a data center scale AI infrastructure company reshaping all industries.\nOur two operating segments are \"Compute & Networking\" and \"Graphics.\" Refer to Note 16 of the Notes to the Consolidated Financial Statements in Part IV,\nItem 15 of this Annual Report on Form 10-K for additional information.\nHeadquartered in Santa Clara, California, NVIDIA was incorporated in California in April 1993 and reincorporated in Delaware in April 1998.\nRecent Developments, Future Objectives and Challenges\nRevenue growth in fiscal year 2026 was driven by data center compute and networking platforms for accelerated computing and AI solutions. Our Blackwell. Table of Contents\nNVIDIA Corporation and Subsidiaries\nNotes to the Consolidated Financial Statements\n(Continued)\nCODM reviews expenses on a consolidated basis, and expenses attributable to each segment are not regularly provided to our CODM.\nThe Compute & Networking segment includes our Data Center accelerated computing and networking platforms and AI solutions and software, and Automotive\nplatforms and autonomous and electric vehicle solutions including software.\nThe Graphics segment includes GeForce GPUs for gaming and PCs, and Quadro/NVIDIA RTX GPUs for enterprise workstation graphics.\nCertain expenses are not allocated to either Compute & Networking or Graphics for purposes of making operating decisions or assessing financial performance.\nThe expenses include stock-based compensation expense, corporate infrastructure and support costs, acquisition-related and other costs, and other non-\nrecurring charges and benefits that our CODM deems to be enterprise in nature.. We report our business results in two segments.\nThe Compute & Networking segment includes our Data Center accelerated computing and networking platforms and AI solutions and software, and Automotive\nplatforms and autonomous and electric vehicle solutions including software.\nThe Graphics segment includes GeForce GPUs for gaming and PCs, and Quadro/NVIDIA RTX GPUs for enterprise workstation graphics.\nOur Markets\nWe specialize in markets where our computing and AI infrastructure platforms can provide tremendous acceleration for applications. These platforms incorporate\nprocessors, interconnects, software, algorithms, systems, and services to deliver unique value. Our platforms address four large markets where our expertise is\ncritical: Data Center, Gaming, Professional Visualization, and Automotive.\nData Center\nThe NVIDIA Data Center platform is focused on accelerating compute-intensive workloads, such as AI, data processing, graphics, robotics, and scientific. Table of Contents\nPart I\nItem 1. Business\nOur Company\nNVIDIA pioneered accelerated computing to help solve the most challenging computational problems. NVIDIA is now a data center scale AI infrastructure\ncompany reshaping all industries.\nOur technology stack includes the foundational NVIDIA CUDA development platform that runs on all NVIDIA GPUs, as well as hundreds of domain-specific\nsoftware libraries, frameworks, algorithms, software development kits, or SDKs, and application programming interfaces, or APIs. This deep and broad software\nstack accelerates the performance and facilitates the deployment of NVIDIA accelerated computing for computationally intensive workloads such as artificial\nintelligence, or AI, model training and inference, data analytics, scientific computing, robotics, and 3D graphics, with vertical-specific optimizations to address\nindustries ranging from healthcare and telecom to automotive and manufacturing.. Data Center\nThe NVIDIA Data Center platform is focused on accelerating compute-intensive workloads, such as AI, data processing, graphics, robotics, and scientific\ncomputing, delivering superior total cost of ownership relative to conventional CPU-only approaches. It is deployed in cloud, hyperscale, on-premises and edge\ndata centers. The platform consists of data center compute and networking infrastructure offerings typically delivered to customers as rack-scale systems,\nsubsystems, or modules, along with software and services.\nOur Data Center infrastructure systems include supercomputing platforms and servers, bringing together our higher performance, energy efficient GPUs, CPUs,\ninterconnects, and fully optimized AI and HPC software stacks. In addition, they include a growing body of acceleration libraries, AI models and training data\nsets, APIs, SDKs, and domain-specific application frameworks.",
        "answer": "The Compute & Networking segment includes NVIDIA's Data Center accelerated computing and networking platforms, AI solutions and software, and Automotive platforms and autonomous and electric vehicle solutions including software.",
        "context_adherence": "1.0",
        "context_precision": "0.6",
        "answer_relevance": "0.810",
        "groundedness": "{\n    \"score\": 1.0,\n    \"unsupported_claims\": [],\n    \"reason\": \"All claims in the answer are directly supported by the context.\"\n}"
    },
    {
        "UseCase_id": "UC:1",
        "QNo": 8,
        "question": "How much depreciation expense did NVIDIA report in fiscal year 2024?",
        "context": "Table of Contents\nNVIDIA Corporation and Subsidiaries\nNotes to the Consolidated Financial Statements\n(Continued)\n(B)\nThe estimated useful lives of our buildings are up to thirty years. Leasehold improvements and finance leases are amortized based on the lesser of either the asset’s estimated useful life or the\nexpected remaining lease term.\n(C)\nConstruction in process represents assets that are not available for their intended use.\nDepreciation expense for fiscal years 2026, 2025, and 2024 was $2.4 billion, $1.3 billion, and $894 million, respectively.\nAccumulated amortization of leasehold improvements and finance leases was $519 million and $410 million as of January 25, 2026 and January 26, 2025,\nrespectively.\nProperty, equipment and intangible assets acquired but not paid for during fiscal years 2026, 2025, and 2024 were $820 million, $525 million, and $170 million,\nrespectively.\n \nJan 25, 2026\nJan 26, 2025\nAccrued and Other Current Liabilities:\n(In millions). Table of Contents\nNVIDIA Corporation and Subsidiaries\nNotes to the Consolidated Financial Statements\n(Continued)\nThe income tax expense (benefit) differs from the amount computed by applying the U.S. federal statutory rate of 21% to income before income taxes for fiscal\nyears ended January 26, 2025 and January 28, 2024 as follows:\nYear Ended\nJan 26, 2025\nJan 28, 2024\n(In millions, except percentages)\nTax expense computed at federal statutory rate\n$\n17,645 \n21.0 %\n$\n7,102 \n21.0 %\nExpense (benefit) resulting from:\nState income taxes, net of federal tax effect\n554 \n0.7 %\n120 \n0.4 %\nForeign-derived deduction eligible income\n(2,976)\n(3.5)%\n(1,408)\n(4.2)%\nStock-based compensation\n(2,097)\n(2.5)%\n(741)\n(2.2)%\nU.S. federal research and development tax credit\n(990)\n(1.2)%\n(431)\n(1.3)%\nForeign tax rate differential\n(984)\n(1.2)%\n(467)\n(1.4)%\nOther\n(6)\n— %\n(117)\n(0.3)%\nIncome tax expense\n$\n11,146 \n13.3 %\n$\n4,058 \n12.0 %. Table of Contents\nNVIDIA Corporation and Subsidiaries\nNotes to the Consolidated Financial Statements\n(Continued)\nNote 6 - Amortizable Intangible Assets\nThe components of our amortizable intangible assets are as follows:\n \nJan 25, 2026\nJan 26, 2025\n \nGross\nCarrying\nAmount\nAccumulated\nAmortization\nNet \nCarrying\nAmount\nGross\nCarrying\nAmount\nAccumulated\nAmortization\nNet \nCarrying\nAmount\n \n(In millions)\nAcquisition-related intangible\nassets\n$\n5,656 \n$\n(2,580)\n$\n3,076 \n$\n2,900 \n$\n(2,264)\n$\n636 \nPatents and licensed technology\n528 \n(298)\n230 \n449 \n(278)\n171 \nTotal intangible assets\n$\n6,184 \n$\n(2,878)\n$\n3,306 \n$\n3,349 \n$\n(2,542)\n$\n807 \nAmortization expense associated with intangible assets for fiscal years 2026, 2025, and 2024 was $488 million, $593 million, and $614 million, respectively.\nThe following table outlines the estimated future amortization expense related to the net carrying amount of intangible assets as of January 25, 2026:\nFuture Amortization Expense\n \n(In millions)\nFiscal Year:. Table of Contents\nNVIDIA Corporation and Subsidiaries\nNotes to the Consolidated Financial Statements\n(Continued)\nAccrual for Product Warranty Liabilities\nThe estimated amount of product warranty liabilities was $2.8 billion and $1.3 billion as of January 25, 2026 and January 26, 2025, respectively. The estimated\nproduct returns and product warranty activity consisted of the following:\nYear Ended\nJan 25, 2026\nJan 26, 2025\nJan 28, 2024\n(In millions)\nBalance at beginning of period\n$\n1,290 \n$\n306 \n$\n82 \nAdditions\n2,474 \n1,203 \n278 \nUtilization\n(957)\n(219)\n(54)\nBalance at end of period\n$\n2,807 \n$\n1,290 \n$\n306 \nIn fiscal years 2026, 2025, and 2024 the additions in product warranty liabilities primarily related to our Compute & Networking segment.\nWe have provided indemnities for matters such as tax, product, and employee liabilities. We have included intellectual property indemnification provisions in our. Table of Contents\nNVIDIA Corporation and Subsidiaries\nNotes to the Consolidated Financial Statements\n(Continued)\nA reconciliation of segment operating income to consolidated income before income tax for fiscal years 2026, 2025, and 2024 were as follows:\nYear Ended\nJan 25, 2026\nJan 26, 2025\nJan 28, 2024\n(In millions)\nSegment operating income\n$\n139,297 \n$\n87,960 \n$\n37,862 \nStock-based compensation expense\n(6,386)\n(4,737)\n(3,549)\nUnallocated operating expenses\n(1,997)\n(1,171)\n(728)\nAcquisition-related and other costs\n(527)\n(599)\n(613)\nInterest income\n2,300 \n1,786 \n866 \nInterest expense\n(259)\n(247)\n(257)\nOther income, net\n9,022 \n1,034 \n237 \nConsolidated income before income tax\n$\n141,450 \n$\n84,026 \n$\n33,818 \nRevenue by geographic area is based upon the location of the customers’ headquarters. The end customer and shipping location may be different from our\ncustomers' headquarters location.\n \nYear Ended\n \nJan 25, 2026\nJan 26, 2025\nJan 28, 2024",
        "answer": "NVIDIA reported depreciation expense of $894 million in fiscal year 2024.",
        "context_adherence": "1.0",
        "context_precision": "0.4",
        "answer_relevance": "0.902",
        "groundedness": "{\n    \"score\": 1.0,\n    \"unsupported_claims\": [],\n    \"reason\": \"The claim about NVIDIA reporting depreciation expense of $894 million in fiscal year 2024 is directly supported by the context provided.\"\n}"
    },
    {
        "UseCase_id": "UC:1",
        "QNo": 9,
        "question": "What are NVIDIA future operating lease obligations for fiscal year 2027?",
        "context": "Table of Contents\nNVIDIA Corporation and Subsidiaries\nNotes to the Consolidated Financial Statements\n(Continued)\nOperating lease costs for fiscal years 2026, 2025, and 2024 were $462 million, $356 million, and $269 million, respectively. Short-term and variable lease costs\nfor fiscal years 2026, 2025, and 2024 were not significant.\nOther information related to leases was as follows:\nYear Ended\nJan 25, 2026\nJan 26, 2025\nJan 28, 2024\n \n(In millions)\nSupplemental cash flows information\n \nOperating cash flow used for operating leases\n$\n428 \n$\n313 \n$\n286 \nOperating lease assets obtained in exchange for lease\nobligations\n$\n1,439 \n$\n877 \n$\n531 \nAs of January 25, 2026, our operating leases have a weighted average remaining lease term of 8.8 years and a weighted average discount rate of 4.38%. As of\nJanuary 26, 2025, our operating leases had a weighted average remaining lease term of 6.5 years and a weighted average discount rate of 4.16%.\n80. Table of Contents\nNVIDIA Corporation and Subsidiaries\nNotes to the Consolidated Financial Statements\n(Continued)\n(B)\nThe estimated useful lives of our buildings are up to thirty years. Leasehold improvements and finance leases are amortized based on the lesser of either the asset’s estimated useful life or the\nexpected remaining lease term.\n(C)\nConstruction in process represents assets that are not available for their intended use.\nDepreciation expense for fiscal years 2026, 2025, and 2024 was $2.4 billion, $1.3 billion, and $894 million, respectively.\nAccumulated amortization of leasehold improvements and finance leases was $519 million and $410 million as of January 25, 2026 and January 26, 2025,\nrespectively.\nProperty, equipment and intangible assets acquired but not paid for during fiscal years 2026, 2025, and 2024 were $820 million, $525 million, and $170 million,\nrespectively.\n \nJan 25, 2026\nJan 26, 2025\nAccrued and Other Current Liabilities:\n(In millions). $\n2,572 \nBetween fiscal years 2027 and 2030, we expect to commence leases with future obligations of $22.7 billion, primarily data center leases to support our research\nand development efforts, with lease terms of 1.8 to 20 years.\n79. Table of Contents\nNVIDIA Corporation and Subsidiaries\nNotes to the Consolidated Financial Statements\n(Continued)\nAccrual for Product Warranty Liabilities\nThe estimated amount of product warranty liabilities was $2.8 billion and $1.3 billion as of January 25, 2026 and January 26, 2025, respectively. The estimated\nproduct returns and product warranty activity consisted of the following:\nYear Ended\nJan 25, 2026\nJan 26, 2025\nJan 28, 2024\n(In millions)\nBalance at beginning of period\n$\n1,290 \n$\n306 \n$\n82 \nAdditions\n2,474 \n1,203 \n278 \nUtilization\n(957)\n(219)\n(54)\nBalance at end of period\n$\n2,807 \n$\n1,290 \n$\n306 \nIn fiscal years 2026, 2025, and 2024 the additions in product warranty liabilities primarily related to our Compute & Networking segment.\nWe have provided indemnities for matters such as tax, product, and employee liabilities. We have included intellectual property indemnification provisions in our. Jan 26, 2025\nLong-lived assets:\n(In millions)\nUnited States\n$\n5,125 \n$\n3,626 \nTaiwan\n3,219 \n1,481 \nIsrael\n1,471 \n840 \nOther\n568 \n336 \nTotal long-lived assets\n$\n10,383 \n$\n6,283 \nNote 17 - Leases\nOur lease obligations primarily consist of operating leases for our offices and data centers, with lease periods expiring between fiscal years 2027 and 2041.\nFuture minimum lease obligations under our non-cancelable lease agreements as of January 25, 2026 were as follows:\nOperating Lease Obligations\n \n(In millions)\nFiscal Year:\n \n2027\n$\n493 \n2028\n485 \n2029\n457 \n2030\n381 \n2031\n314 \n2032 and thereafter\n1,494 \nTotal\n3,624 \nLess imputed interest\n680 \nPresent value of net future minimum lease payments\n2,944 \nLess short-term operating lease liabilities\n372 \nLong-term operating lease liabilities\n$\n2,572 \nBetween fiscal years 2027 and 2030, we expect to commence leases with future obligations of $22.7 billion, primarily data center leases to support our research",
        "answer": "NVIDIA's future operating lease obligations for fiscal year 2027 are $493 million.",
        "context_adherence": "1.0",
        "context_precision": "0.4",
        "answer_relevance": "0.873",
        "groundedness": "{\n    \"score\": 1.0,\n    \"unsupported_claims\": [],\n    \"reason\": \"The claim about NVIDIA's future operating lease obligations for fiscal year 2027 being $493 million is directly supported by the context provided.\"\n}"
    },
    {
        "UseCase_id": "UC:1",
        "QNo": 10,
        "question": "How does NVIDIA define direct customers versus indirect customers?",
        "context": "Table of Contents\nConcentration of Revenue\nWe refer to customers who purchase products directly from NVIDIA as direct customers, such as AIBs, distributors, ODMs, OEMs, CSPs, AI model makers, and\nsystem integrators. Certain direct customers may use either internal resources or third-party system integrators to complete their build. We refer to indirect\ncustomers as those who purchase products through our direct customers; indirect customers include CSPs, Neocloud builders, AI model makers, enterprises,\nand public sector entities. Our revenue is concentrated among a limited number of direct and indirect customers and this trend may continue.\nDirect Customers – For fiscal year 2026, sales to one direct customer represented 22% of total revenue and sales to another direct customer represented 14%\nof total revenue, all of which were primarily attributable to the Compute & Networking segment.. Revenue from sales to customers headquartered outside of the United States accounted for 31%, 41%, and 48% of total revenue for fiscal years 2026, 2025,\nand 2024, respectively. The increase in revenue to the United States for fiscal years 2026 and 2025 was primarily due to higher U.S.-based Compute &\nNetworking segment demand.\nWe refer to customers who purchase products directly from NVIDIA as direct customers, such as AIBs, distributors, ODMs, OEMs, CSPs, AI model makers, and\nsystem integrators. Certain direct customers may use either internal resources or third-party system integrators to complete their build. We refer to indirect\ncustomers as those who purchase products through our direct customers; indirect customers include CSPs, Neocloud builders, AI model makers, enterprises,\nand public sector entities. Our revenue is concentrated among a limited number of direct and indirect customers and this trend may continue.. of total revenue, all of which were primarily attributable to the Compute & Networking segment.\nFor fiscal year 2025, sales to one direct customer represented 12% of total revenue and sales to two direct customers each represented 11% of total revenue, all\nof which were primarily attributable to the Compute & Networking segment.\nFor fiscal year 2024, sales to one direct customer represented 13% of total revenue, and were primarily attributable to the Compute & Networking segment.\nIndirect Customers – Indirect customer revenue is an estimation based upon multiple factors including customer purchase order information, product\nspecifications, internal sales data, and other sources. Indirect customers primarily purchase our products through system integrators and distributors. We\ngenerate a significant amount of our revenue from a limited number of indirect customers, some individually representing 10% or more of our revenue. Certain. We account for customer programs, which involve rebates and marketing development funds, or MDFs, as a reduction in revenue and accrue for such programs\nbased on the amount we expect to be claimed by customers. Certain customer programs include distributor price incentives or other channel programs for\nspecific products and customer classes which require judgment as to whether the applicable incentives will be attained. Estimates for customer program\naccruals include a combination of historical attainment and claim rates and may be adjusted based on relevant internal and external factors.\nContracts with Multiple Performance Obligations\nOur contracts may contain more than one performance obligation. Judgment is required in determining whether each performance obligation within a customer\ncontract is distinct. Except for License and Development Arrangements, NVIDIA products and services function on a standalone basis and do not require a. Our customer programs involve rebates, which are designed to serve as sales incentives to resellers of our products in various target markets, and MDFs which\nrepresent monies paid to our partners that are earmarked for market segment development and are designed to support our partners’ activities while also\npromoting NVIDIA products. We account for customer programs as a reduction to revenue and accrue for such programs for potential rebates and MDFs based\non the amount we expect to be claimed by customers.\n56",
        "answer": "NVIDIA defines direct customers as those who purchase products directly from NVIDIA, including AIBs, distributors, ODMs, OEMs, CSPs, AI model makers, and system integrators. Indirect customers are those who purchase products through direct customers, which include CSPs, Neocloud builders, AI model makers, enterprises, and public sector entities.",
        "context_adherence": "1.0",
        "context_precision": "0.6",
        "answer_relevance": "0.864",
        "groundedness": "{\n    \"score\": 1.0,\n    \"unsupported_claims\": [],\n    \"reason\": \"All claims in the answer are directly supported by the context provided.\"\n}"
    },
    {
        "UseCase_id": "UC:1",
        "QNo": 11,
        "question": "What strategic and competitive risks does Microsoft disclose in its risk factors?",
        "context": "factors. \n•\nOur business is exposed to the burden and risks associated with litigation, investigations, and regulatory proceedings. \n•\nDelaware law, provisions in our governing documents and our agreement with Microsoft could delay or prevent a change in control. \n13. 2\nMICROSOFT CORPORATION\nFORM 10-K \nFor the Fiscal Year Ended June 30, 2025\nINDEX\n \n \n \n \n \n \nPage \n \n \n \n \nPART I\n   \n \n  \n \n \n \n \n \n  Item 1.\n  Business\n \n3 \n \n \n \n \n \n \n \n  Information about our Executive Officers\n \n14 \n \n \n \n \n \n  Item 1A.\n  Risk Factors\n \n16 \n \n \n \n \n \n  Item 1B.\n  Unresolved Staff Comments\n \n30 \n \n \n \n \n \n  Item 1C.\n  Cybersecurity\n \n30 \n \n \n \n \n \n \n  \n \n  Item 2.\n  Properties\n \n32 \n \n \n \n \n \n  Item 3.\n  Legal Proceedings\n \n32 \n \n \n \n \n \n  Item 4.\n  Mine Safety Disclosures\n \n32 \n \n \n \n \nPART II\n \n \n \n  \n \n \n \n \n \n \nItem 5.\n \nMarket for Registrant’s Common Equity, Related Stockholder Matters, and Issuer Purchases of Equity \nSecurities\n \n33 \n \n \n \n \n \n  Item 6.\n  [Reserved]\n \n34 \n \n \n \n \n \n  Item 7.\n  Management’s Discussion and Analysis of Financial Condition and Results of Operations\n \n35 \n \n \n \n \n \n  Item 7A.\n  Quantitative and Qualitative Disclosures About Market Risk\n \n49 \n \n \n \n \n \n  Item 8.\n  Financial Statements and Supplementary Data\n \n50. PART I\nItem 1A\n \n16\nITEM 1A. RISK FACTORS\nOur operations and financial results are subject to various risks and uncertainties, including those described below, that could adversely \naffect our business, operations, financial condition, results of operations, liquidity, and the trading price of our common stock.\nSTRATEGIC AND COMPETITIVE RISKS\nWe face intense competition across all markets for our products and services, which could adversely affect our results of \noperations.\nCompetition in the technology sector\nOur competitors range in size from diversified global companies with significant research and development resources to small, specialized \nfirms whose narrower product lines may let them be more effective in deploying technical, marketing, and financial resources. Barriers to\nentry in many of our businesses are low and many of the areas in which we compete evolve rapidly with changing and disruptive. presently known to us or that we currently believe are immaterial may also harm our business, financial condition, results of operations or reputation.\nRisk Factors Summary\nRisks Related to Our Industry and Markets\n•\nFailure to meet the evolving needs of our industry and markets may adversely impact our financial results.\n•\nCompetition could adversely impact our market share and financial results.\nRisks Related to Demand, Supply, and Manufacturing\n•\nLong manufacturing lead times and uncertain supply and capacity availability, combined with a failure to estimate customer demand accurately has led\nand could lead to mismatches between supply and demand.\n12. Table of Contents\nRisk Factors\nRisks Related to Our Industry and Markets\nFailure to meet the evolving needs of our industry and markets may adversely impact our financial results.\nOur accelerated computing platforms experience rapid changes in technology, customer requirements, competitive products, and industry standards.\nOur success depends on our ability to:\n•\ntimely identify industry changes, adapt our strategies, and develop new or enhance and maintain existing products and technologies that meet the\nevolving needs of our markets, including addressing unexpected shifts in industry standards or disruptive technological innovations that could render\nour products incompatible with those developed by other companies;\n•\ndevelop or secure access to new products and technologies through investments in research and development;\n•\nlaunch new offerings with new business models including software, services, and cloud solutions, as well as software-, infrastructure-, or platform-as-a-",
        "answer": "Microsoft discloses the following strategic and competitive risks in its risk factors:\n\n1. Intense competition across all markets for its products and services, which could adversely affect its results of operations.\n2. Competitors range in size from diversified global companies with significant research and development resources to small, specialized firms, which may be more effective in deploying technical, marketing, and financial resources.\n3. Barriers to entry in many businesses are low, and many areas of competition evolve rapidly with changing and disruptive technologies.\n4. Failure to meet the evolving needs of the industry and markets may adversely impact financial results.\n5. Competition could adversely impact market share and financial results.",
        "context_adherence": "1.0",
        "context_precision": "0.8",
        "answer_relevance": "0.904",
        "groundedness": "{\n    \"score\": 1.0,\n    \"unsupported_claims\": [],\n    \"reason\": \"All claims in the answer are directly supported by the context provided.\"\n}"
    },
    {
        "UseCase_id": "UC:1",
        "QNo": 12,
        "question": "How does Microsoft describe competition in the technology sector?",
        "context": "advertising solutions. In addition to first-party tools, we have several partnerships with companies through which we provide and monetize \nsearch offerings. Growth depends on our ability to attract new users, understand intent, and match intent with relevant content on advertising \nofferings.\nCompetition \nWindows faces competition from various software products and from alternative platforms and devices. We believe Windows competes \neffectively by giving customers choice, value, flexibility, security, an easy-to-use interface, and compatibility with a broad range of hardware \nand software applications, including those that enable productivity. \nDevices face competition from various computer, tablet, and hardware manufacturers who offer a unique combination of high-quality \nindustrial design and innovative technologies across various price points. Many of these manufacturers are also current or potential partners \nand customers, including our Windows OEMs.. •\nSearch and news advertising, comprising Bing and Copilot, Microsoft News, Microsoft Edge, and third-party affiliates.\nWindows and Devices\nThe Windows operating system is designed to deliver a more personal computing experience for users by enabling consistency of \nexperience, applications, and information across their devices. Windows OEM revenue is impacted significantly by the number of Windows \noperating system licenses purchased by OEMs, which they pre-install on the devices they sell. In addition to computing device market \nvolume, Windows OEM revenue is impacted by: \n•\nThe mix of computing devices based on form factor and screen size.\n•\nDifferences in device market demand between developed markets and growth markets.\n•\nGrowth of the AI PC category.\n•\nAttachment of Windows to devices shipped.\n•\nCustomer mix between consumer, small and medium businesses, and large enterprises.\n•\nChanges in inventory levels in the OEM channel.\n•. support, conformity to industry standard APIs, manufacturing capabilities, processor pricing, and total system costs. We believe that our ability to remain\ncompetitive will depend on how well we are able to anticipate the features and functions that customers and partners will\n8. PART II\nItem 7\n \n38\nMore Personal Computing\nMetrics related to our More Personal Computing segment assess the performance of our key consumer businesses.\n \nWindows OEM and Devices revenue growth\n \nRevenue from sales of Windows Pro and non-Pro licenses sold through the OEM \nchannel and sales of first-party Devices, including Surface and PC accessories\n \n \n \nXbox content and services revenue growth \n \nRevenue from Xbox content and services, comprising first- and third-party content \n(including games and in-game content), Xbox Game Pass and other subscriptions, \nXbox Cloud Gaming, advertising, and other cloud services\n \n \n \nSearch and news advertising revenue (ex TAC) \ngrowth\n \nRevenue from search and news advertising excluding traffic acquisition costs \n(“TAC”) paid to Bing Ads network publishers and news partners\nSUMMARY RESULTS OF OPERATIONS\n \n(In millions, except percentages and per share amounts)\n \n2025   \n2024   \nPercentage\nChange  \n \n \n \n \n \n \n \n \n \n \n \n \n \n \n \n \n \n \n \n \nRevenue\n $. growth of 11%.\n•\nLinkedIn revenue increased 9%.\n•\nDynamics products and cloud services revenue increased 15% driven by Dynamics 365 revenue growth of 19%.\n•\nServer products and cloud services revenue increased 23% driven by Azure and other cloud services revenue growth of 34%.\n•\nWindows OEM and Devices revenue increased 3%.\n•\nXbox content and services revenue increased 16%.\n•\nSearch and news advertising revenue excluding traffic acquisition costs increased 20%.\nIndustry Trends and Opportunities\nOur industry is dynamic and highly competitive, with frequent changes in both technologies and business models. Each industry shift is an \nopportunity to conceive new products, new technologies, or new ideas that can further transform the industry and our business. At Microsoft, \nwe push the boundaries of what is possible through a broad range of research and development activities that seek to identify and address",
        "answer": "Microsoft describes competition in the technology sector as facing various software products and alternative platforms and devices. They believe they compete effectively by providing customers with choice, value, flexibility, security, an easy-to-use interface, and compatibility with a broad range of hardware and software applications. Additionally, devices face competition from various computer, tablet, and hardware manufacturers that offer high-quality industrial design and innovative technologies across different price points.",
        "context_adherence": "1.0",
        "context_precision": "0.2",
        "answer_relevance": "0.832",
        "groundedness": "{\n    \"score\": 1.0,\n    \"unsupported_claims\": [],\n    \"reason\": \"All claims in the answer are supported by the context provided.\"\n}"
    },
    {
        "UseCase_id": "UC:1",
        "QNo": 13,
        "question": "What products are included in Microsoft Intelligent Cloud segment?",
        "context": "PART II\nItem 8\n \n83\nIntelligent Cloud\nOur Intelligent Cloud segment consists of our public, private, and hybrid server products and cloud services that power modern business and \ndevelopers. This segment primarily comprises:\n•\nServer products and cloud services, including Azure and other cloud services, comprising cloud and AI consumption-based \nservices, GitHub cloud services, Nuance Healthcare cloud services, virtual desktop offerings, and other cloud services; and \nServer products, comprising SQL Server, Windows Server, Visual Studio, System Center, related Client Access Licenses \n(“CALs”), and other on-premises offerings.\n•\nEnterprise and partner services, including Enterprise Support Services, Industry Solutions, Nuance professional services, \nMicrosoft Partner Network, and Learning Experience.\nMore Personal Computing\nOur More Personal Computing segment consists of products and services that put customers at the center of the experience with our. vendors, and numerous other security point solution vendors.\nLinkedIn faces competition from online professional networks; recruiting, talent management, and human resource services companies; job \nboards; companies that provide learning and development products and services; online and offline outlets that generate revenue from \nadvertisers and marketers; and online and offline outlets for companies with lead generation and customer intelligence and insights.\nDynamics competes with cloud-based and on-premises business solution providers.\nIntelligent Cloud\nOur Intelligent Cloud segment consists of our public, private, and hybrid server products and cloud services that power modern business and \ndevelopers. This segment primarily comprises:\n•\nServer products and cloud services, including Azure and other cloud services, comprising cloud and AI consumption-based \nservices, GitHub cloud services, Nuance Healthcare cloud services, virtual desktop offerings, and other cloud services; and. PART I\nItem 1\n \n7\nServer Products and Cloud Services\nAzure is a comprehensive set of cloud services that offer developers, IT professionals, and enterprises freedom to build, deploy, and manage \napplications on any platform or device. Customers can use Azure through our global network of datacenters for computing, networking, \nstorage, mobile and web application services, AI, Internet of Things, cognitive services, and machine learning. Azure enables customers to \ndevote more resources to development and use of applications that benefit their organizations, rather than managing on-premises hardware \nand software. Azure revenue is mainly affected by infrastructure-as-a-service and platform-as-a-service consumption-based services.\nAzure AI offerings provide a competitive advantage as companies seek ways to optimize and scale their business with AI. We offer. Processes segment. Beginning in fiscal year 2025, the information that our chief operating decision maker is regularly provided and reviews \nfor purposes of allocating resources and assessing performance reflects these segment changes.\nAdditional information on our operating segments and geographic and product information is contained in Note 18 – Segment Information \nand Geographic Data of the Notes to Financial Statements (Part II, Item 8 of this Form 10-K).\nOur reportable segments are described below.\nProductivity and Business Processes\nOur Productivity and Business Processes segment consists of products and services in our portfolio of productivity, communication, and \ninformation services, spanning a variety of devices and platforms. This segment primarily comprises:\n•\nMicrosoft 365 Commercial products and cloud services, including Microsoft 365 Commercial cloud, comprising Microsoft 365. PART II\nItem 8\n \n85\nRevenue, classified by significant product and service offerings, was as follows: \n \n(In millions)\n  \n \n \n \n \n \n \n \n \nYear Ended June 30,\n \n2025  \n2024  \n2023 \n \n \n  \nServer products and cloud services\n  $\n98,435  $\n79,828  $\n65,007 \nMicrosoft 365 Commercial products and cloud services\n  \n87,767  \n \n76,969   \n66,949 \nGaming\n  \n23,455   \n21,503   \n15,466 \nLinkedIn\n  \n17,812\n    \n16,372\n    \n14,989 \nWindows and Devices\n \n \n17,314   \n \n17,026    \n17,147 \nSearch and news advertising\n  \n13,878  \n \n12,306  \n \n12,125 \nDynamics products and cloud services\n   \n7,827     \n6,831     \n5,796 \nEnterprise and partner services\n   \n7,760     \n7,594     \n7,900 \nMicrosoft 365 Consumer products and cloud services\n  \n7,404   \n6,648   \n6,417 \nOther\n   \n72     \n45     \n119 \n \n \n \n \n \n \n \n \n  \n \n \n \n \n \n \n \n \n \n \n \n  \nTotal\n $\n281,724  $\n245,122  $\n211,915",
        "answer": "The Microsoft Intelligent Cloud segment primarily comprises:\n\n- Server products and cloud services, including Azure and other cloud services, comprising cloud and AI consumption-based services, GitHub cloud services, Nuance Healthcare cloud services, virtual desktop offerings, and other cloud services.\n- Server products, comprising SQL Server, Windows Server, Visual Studio, System Center, related Client Access Licenses (CALs), and other on-premises offerings.\n- Enterprise and partner services, including Enterprise Support Services, Industry Solutions, Nuance professional services, Microsoft Partner Network, and Learning Experience.",
        "context_adherence": "1.0",
        "context_precision": "0.8",
        "answer_relevance": "0.805",
        "groundedness": "{\n    \"score\": 1.0,\n    \"unsupported_claims\": [],\n    \"reason\": \"All claims in the answer are directly supported by the context provided.\"\n}"
    },
    {
        "UseCase_id": "UC:1",
        "QNo": 14,
        "question": "How is Azure revenue primarily generated?",
        "context": "SUMMARY RESULTS OF OPERATIONS\n \n(In millions, except percentages and per share amounts)\n \n2025   \n2024   \nPercentage\nChange  \n \n \n \n \n \n \n \n \n \n \n \n \n \n \n \n \n \n \n \n \nRevenue\n $\n281,724  $\n245,122    \n15%  \nGross margin\n  \n193,893   \n171,008    \n13%  \nOperating income\n  \n128,528   \n109,433    \n17%  \nNet income\n  \n101,832   \n88,136    \n16%  \nDiluted earnings per share\n  \n13.64   \n11.80    \n16%  \n \n \n \n  \n \n \n \n \n \n \n \n \n \n \n \n \n \n \n \n \n \n \n \n \n \n \nFiscal Year 2025 Compared with Fiscal Year 2024\nRevenue increased $36.6 billion or 15% with growth across each of our segments. Intelligent Cloud revenue increased driven by Azure. \nProductivity and Business Processes revenue increased driven by Microsoft 365 Commercial cloud. More Personal Computing revenue \nincreased driven by Gaming and Search and news advertising.\nCost of revenue increased $13.7 billion or 19% driven by growth in Microsoft Cloud.\nGross margin increased $22.9 billion or 13% with growth across each of our segments. \n•. PART II\nItem 7\n \n40\nIntelligent Cloud \nRevenue increased $18.8 billion or 21%.\n•\nServer products and cloud services revenue increased $18.6 billion or 23% driven by Azure and other cloud services. Azure and \nother cloud services revenue grew 34% driven by demand for our portfolio of services. Server products revenue decreased 3% \ndriven by a decrease in transactional purchasing with continued customer shift to cloud offerings.\n•\nEnterprise and partner services revenue increased $166 million or 2% driven by growth in Enterprise Support Services, offset in \npart by a decline in Industry Solutions.\nOperating income increased $6.8 billion or 18%.\n•\nCost of revenue increased $10.6 billion or 36% driven by growth in Azure.\n•\nGross margin increased $8.2 billion or 14% driven by growth in Azure. Gross margin percentage decreased driven by the impact \nof scaling our AI infrastructure, offset in part by efficiency gains in Azure.\n•. of scaling our AI infrastructure, offset in part by efficiency gains in Azure.\n•\nOperating expenses increased $1.5 billion or 7% driven by investments in cloud and AI engineering.\nMore Personal Computing \nRevenue increased $3.8 billion or 7%.\n•\nWindows and Devices revenue increased $288 million or 2%. Windows OEM and Devices revenue increased 3% driven by \ngrowth in Windows OEM, offset in part by a decline in Devices. \n•\nGaming revenue increased $2.0 billion or 9% driven by growth in Xbox content and services, offset in part by a decline in Xbox \nhardware. Xbox content and services revenue increased 16% driven by the impact of the Activision Blizzard acquisition and \nXbox Game Pass. Xbox hardware revenue decreased 25% driven by lower volume of consoles sold.\n•\nSearch and news advertising revenue increased $1.6 billion or 13%. Search and news advertising revenue excluding traffic \nacquisition costs increased 20% driven by higher search volume and higher revenue per search.. Cost of revenue increased $13.7 billion or 19% driven by growth in Microsoft Cloud.\nGross margin increased $22.9 billion or 13% with growth across each of our segments. \n•\nGross margin percentage decreased slightly driven by Intelligent Cloud, offset in part by More Personal Computing.\n•\nMicrosoft Cloud gross margin percentage decreased to 69% driven by the impact of scaling our AI infrastructure, offset in part \nby efficiency gains in Azure.\nOperating expenses increased $3.8 billion or 6% driven by investments in cloud and AI engineering and Gaming, including the impact of the \nActivision Blizzard acquisition.\nOperating income increased $19.1 billion or 17% with growth across each of our segments.. PCs, tablets, gaming and entertainment consoles, other intelligent devices, and related accessories. \nService and other revenue includes sales from cloud-based solutions that provide customers with software, services, platforms, and content \nsuch as Office 365, Azure, Dynamics 365, and gaming; solution support; and consulting services. Service and other revenue also includes \nsales from online advertising and LinkedIn.",
        "answer": "Azure revenue is primarily generated through server products and cloud services, driven by demand for the portfolio of services offered.",
        "context_adherence": "1.0",
        "context_precision": "0.6",
        "answer_relevance": "0.866",
        "groundedness": "{\n    \"score\": 1.0,\n    \"unsupported_claims\": [],\n    \"reason\": \"The claim about Azure revenue being generated through server products and cloud services is supported by the context, which states that Azure and other cloud services revenue grew driven by demand for the portfolio of services.\"\n}"
    },
    {
        "UseCase_id": "UC:1",
        "QNo": 15,
        "question": "What competitive advantages does Microsoft claim for Azure?",
        "context": "SUMMARY RESULTS OF OPERATIONS\n \n(In millions, except percentages and per share amounts)\n \n2025   \n2024   \nPercentage\nChange  \n \n \n \n \n \n \n \n \n \n \n \n \n \n \n \n \n \n \n \n \nRevenue\n $\n281,724  $\n245,122    \n15%  \nGross margin\n  \n193,893   \n171,008    \n13%  \nOperating income\n  \n128,528   \n109,433    \n17%  \nNet income\n  \n101,832   \n88,136    \n16%  \nDiluted earnings per share\n  \n13.64   \n11.80    \n16%  \n \n \n \n  \n \n \n \n \n \n \n \n \n \n \n \n \n \n \n \n \n \n \n \n \n \n \nFiscal Year 2025 Compared with Fiscal Year 2024\nRevenue increased $36.6 billion or 15% with growth across each of our segments. Intelligent Cloud revenue increased driven by Azure. \nProductivity and Business Processes revenue increased driven by Microsoft 365 Commercial cloud. More Personal Computing revenue \nincreased driven by Gaming and Search and news advertising.\nCost of revenue increased $13.7 billion or 19% driven by growth in Microsoft Cloud.\nGross margin increased $22.9 billion or 13% with growth across each of our segments. \n•. manage code and incorporate AI and agent-based tools across the software development lifecycle. Nuance Healthcare provides AI solutions \nto the healthcare industry. \nEnterprise and Partner Services\nEnterprise and partner services, including Enterprise Support Services, Industry Solutions, Nuance professional services, Microsoft Partner \nNetwork, and Learning Experience, assist customers in developing, deploying, and managing Microsoft server solutions, Microsoft desktop \nsolutions, and Nuance conversational AI and ambient intelligent solutions, along with providing training and certification to developers and IT \nprofessionals on various Microsoft products.\nCompetition\nAzure faces diverse competition from cloud service providers and open source offerings. Azure’s competitive advantage includes enabling a \nhybrid cloud, allowing deployment of existing datacenters with our public cloud into a single, cohesive infrastructure, and the ability to run at a. PART II\nItem 7\n \n40\nIntelligent Cloud \nRevenue increased $18.8 billion or 21%.\n•\nServer products and cloud services revenue increased $18.6 billion or 23% driven by Azure and other cloud services. Azure and \nother cloud services revenue grew 34% driven by demand for our portfolio of services. Server products revenue decreased 3% \ndriven by a decrease in transactional purchasing with continued customer shift to cloud offerings.\n•\nEnterprise and partner services revenue increased $166 million or 2% driven by growth in Enterprise Support Services, offset in \npart by a decline in Industry Solutions.\nOperating income increased $6.8 billion or 18%.\n•\nCost of revenue increased $10.6 billion or 36% driven by growth in Azure.\n•\nGross margin increased $8.2 billion or 14% driven by growth in Azure. Gross margin percentage decreased driven by the impact \nof scaling our AI infrastructure, offset in part by efficiency gains in Azure.\n•. decreased slightly primarily driven by the impact of scaling our AI infrastructure, offset in part by efficiency gains in Microsoft 365 \nCommercial cloud.\n•\nOperating expenses increased $1.1 billion or 4% driven by investments in cloud and AI engineering and commercial sales.. Cost of revenue increased $13.7 billion or 19% driven by growth in Microsoft Cloud.\nGross margin increased $22.9 billion or 13% with growth across each of our segments. \n•\nGross margin percentage decreased slightly driven by Intelligent Cloud, offset in part by More Personal Computing.\n•\nMicrosoft Cloud gross margin percentage decreased to 69% driven by the impact of scaling our AI infrastructure, offset in part \nby efficiency gains in Azure.\nOperating expenses increased $3.8 billion or 6% driven by investments in cloud and AI engineering and Gaming, including the impact of the \nActivision Blizzard acquisition.\nOperating income increased $19.1 billion or 17% with growth across each of our segments.",
        "answer": "Azure’s competitive advantages include enabling a hybrid cloud, allowing deployment of existing datacenters with their public cloud into a single, cohesive infrastructure, and the ability to run at scale.",
        "context_adherence": "1.0",
        "context_precision": "0.2",
        "answer_relevance": "0.709",
        "groundedness": "{\n    \"score\": 1.0,\n    \"unsupported_claims\": [],\n    \"reason\": \"All claims in the answer are directly supported by the context regarding Azure's competitive advantages.\"\n}"
    },
    {
        "UseCase_id": "UC:1",
        "QNo": 16,
        "question": "What services are included in Microsoft Enterprise and Partner Services?",
        "context": "consulting, and fulfillment functions for our products and services; and managing OEM relationships.\nDirect \nMany organizations that license our products and services transact directly with us through Enterprise Agreements and Enterprise Services \ncontracts, with sales support from system integrators, independent software vendors, web agencies, and partners that advise organizations \non licensing our products and services (“Enterprise Agreement Software Advisors” or “ESA”). Microsoft offers direct sales programs targeted \nto reach small, medium, and corporate customers, in addition to those offered through the reseller channel. A large network of partner \nadvisors support many of these sales. \nWe also sell commercial and consumer products and services directly to customers, such as cloud services, search, and gaming, through \nour digital marketplaces and online stores. Additionally, our Microsoft Experience Centers are designed to facilitate deeper engagement with. services, GitHub cloud services, Nuance Healthcare cloud services, virtual desktop offerings, and other cloud services; and \nServer products, comprising SQL Server, Windows Server, Visual Studio, System Center, related Client Access Licenses \n(“CALs”), and other on-premises offerings.\n•\nEnterprise and partner services, including Enterprise Support Services, Industry Solutions, Nuance professional services, \nMicrosoft Partner Network, and Learning Experience.. PART I\nItem 1\n \n8\nOur database, business intelligence, and data warehousing solutions offerings compete with products from providers in the data and \nanalytics industry. Our system management solutions compete with server management and server virtualization platform providers. Our \nproducts for software developers compete against offerings from major technology providers, as well as open source alternatives. \nWe believe our server products provide customers with advantages in performance, total costs of ownership, and productivity by delivering \nsuperior applications, development tools, compatibility with a broad base of hardware and software applications, security, and manageability. \nOur Enterprise and partner services business competes with a wide range of companies that provide strategy and business planning, \napplication development, and infrastructure services, including multinational consulting firms and small niche businesses focused on specific \ntechnologies.. value-added services offered by their systems integrator, managed services provider, or cloud reseller partner. Partners in this program can \neasily package their own products and services to directly provision, manage, and support their customer subscriptions.\nThe Microsoft Services Provider License Agreement allows hosting service providers and independent software vendors who want to license \neligible Microsoft software products to provide hosted applications and software services to their end customers. Partners license software \nover a three-year period and are billed monthly based on units licensed. \nThe Independent Software Vendor Royalty Program enables partners to integrate Microsoft products into other applications and then license \nthe unified business solution to their end users.\nGOVERNMENT REGULATION \nWe are subject to a wide range of laws, regulations, and legal requirements in the U.S. and globally, including those that may apply to our. our digital marketplaces and online stores. Additionally, our Microsoft Experience Centers are designed to facilitate deeper engagement with \nour partners and customers across industries. \nDistributors and Resellers \nOrganizations also license our products and services indirectly, primarily through licensing solution partners (“LSP”), distributors, value-\nadded resellers (“VAR”), and retailers. Although each type of reselling partner may reach organizations of all sizes, LSPs are primarily \nengaged with large organizations, distributors resell primarily to VARs, and VARs typically reach small and medium organizations. ESAs are \nalso typically authorized as LSPs and operate as resellers for our other volume licensing programs. Microsoft Cloud Solution Provider is our \nmain partner program for reselling cloud services. \nWe distribute our retail packaged products primarily through independent non-exclusive distributors, authorized replicators, resellers, and",
        "answer": "Microsoft Enterprise and Partner Services include Enterprise Support Services, Industry Solutions, Nuance professional services, Microsoft Partner Network, and Learning Experience.",
        "context_adherence": "1.0",
        "context_precision": "0.2",
        "answer_relevance": "0.868",
        "groundedness": "{\n    \"score\": 1.0,\n    \"unsupported_claims\": [],\n    \"reason\": \"All factual claims in the answer are directly supported by the context.\"\n}"
    },
    {
        "UseCase_id": "UC:1",
        "QNo": 17,
        "question": "How does Microsoft describe its Azure AI offerings?",
        "context": "PART I\nItem 1\n \n7\nServer Products and Cloud Services\nAzure is a comprehensive set of cloud services that offer developers, IT professionals, and enterprises freedom to build, deploy, and manage \napplications on any platform or device. Customers can use Azure through our global network of datacenters for computing, networking, \nstorage, mobile and web application services, AI, Internet of Things, cognitive services, and machine learning. Azure enables customers to \ndevote more resources to development and use of applications that benefit their organizations, rather than managing on-premises hardware \nand software. Azure revenue is mainly affected by infrastructure-as-a-service and platform-as-a-service consumption-based services.\nAzure AI offerings provide a competitive advantage as companies seek ways to optimize and scale their business with AI. We offer. Azure AI offerings provide a competitive advantage as companies seek ways to optimize and scale their business with AI. We offer \nsupercomputing power for AI at scale to run large workloads, complemented by our rapidly expanding portfolio of AI cloud services (including \nthe latest models) and hardware, which includes custom-built silicon and strong partnerships with chip manufacturers. Azure AI Foundry is a \nunified platform for developers to design, customize, and manage AI applications and agents.\nOur server products are designed to make IT professionals, developers, and their systems more productive and efficient. Server software is \nintegrated server infrastructure and middleware designed to support software applications built on the Windows Server operating system. \nThis includes the server platform, database, business intelligence, storage, management and operations, virtualization, service-oriented. manage code and incorporate AI and agent-based tools across the software development lifecycle. Nuance Healthcare provides AI solutions \nto the healthcare industry. \nEnterprise and Partner Services\nEnterprise and partner services, including Enterprise Support Services, Industry Solutions, Nuance professional services, Microsoft Partner \nNetwork, and Learning Experience, assist customers in developing, deploying, and managing Microsoft server solutions, Microsoft desktop \nsolutions, and Nuance conversational AI and ambient intelligent solutions, along with providing training and certification to developers and IT \nprofessionals on various Microsoft products.\nCompetition\nAzure faces diverse competition from cloud service providers and open source offerings. Azure’s competitive advantage includes enabling a \nhybrid cloud, allowing deployment of existing datacenters with our public cloud into a single, cohesive infrastructure, and the ability to run at a. which speak only as of the date they are made. We undertake no obligation to update or revise publicly any forward-looking statements, \nwhether because of new information, future events, or otherwise.\nPART I\nITEM 1. BUSINESS\nGENERAL\nMicrosoft is a technology company committed to making digital technology and artificial intelligence (“AI”) available broadly and doing so \nresponsibly. Our mission is to empower every person and every organization on the planet to achieve more. \nWe develop and support a broad portfolio of technology solutions for individuals and businesses, focusing on secure, trusted, and innovative \nplatforms and tools that meet evolving customer needs across cloud computing, productivity and collaboration, and personal computing. We \nstrive to create opportunity, growth, and impact in every country around the world.\nAI is fundamentally transforming productivity for every individual, organization, and industry. Microsoft's AI offerings span every layer of the. decreased slightly primarily driven by the impact of scaling our AI infrastructure, offset in part by efficiency gains in Microsoft 365 \nCommercial cloud.\n•\nOperating expenses increased $1.1 billion or 4% driven by investments in cloud and AI engineering and commercial sales.",
        "answer": "Microsoft describes its Azure AI offerings as providing a competitive advantage as companies seek ways to optimize and scale their business with AI. They offer supercomputing power for AI at scale to run large workloads, complemented by a rapidly expanding portfolio of AI cloud services, including the latest models and hardware, which features custom-built silicon and strong partnerships with chip manufacturers. Azure AI Foundry is highlighted as a unified platform for developers to design, customize, and manage AI applications and agents.",
        "context_adherence": "1.0",
        "context_precision": "0.6",
        "answer_relevance": "0.803",
        "groundedness": "{\n    \"score\": 1.0,\n    \"unsupported_claims\": [],\n    \"reason\": \"All factual claims in the answer are directly supported by the context provided.\"\n}"
    },
    {
        "UseCase_id": "UC:1",
        "QNo": 18,
        "question": "What drives Dynamics revenue according to Microsoft?",
        "context": "revenue grew 11% driven by Microsoft 365 Consumer subscriber growth of 8% to 89.0 million, as well as growth in revenue per \nuser from the price increase announced in January 2025.\n•\nLinkedIn revenue increased $1.4 billion or 9% with growth across all lines of business.\n•\nDynamics products and cloud services revenue increased $996 million or 15% driven by growth in Dynamics 365, offset in part \nby a decline in Dynamics on-premises products. Dynamics 365 revenue grew 19% with growth across all workloads.\nOperating income increased $10.1 billion or 17%.\n•\nCost of revenue increased $2.8 billion or 14% driven by growth in Microsoft 365 Commercial cloud. \n•\nGross margin increased $11.2 billion or 13% driven by growth in Microsoft 365 Commercial cloud. Gross margin percentage \ndecreased slightly primarily driven by the impact of scaling our AI infrastructure, offset in part by efficiency gains in Microsoft 365 \nCommercial cloud.\n•. growth of 11%.\n•\nLinkedIn revenue increased 9%.\n•\nDynamics products and cloud services revenue increased 15% driven by Dynamics 365 revenue growth of 19%.\n•\nServer products and cloud services revenue increased 23% driven by Azure and other cloud services revenue growth of 34%.\n•\nWindows OEM and Devices revenue increased 3%.\n•\nXbox content and services revenue increased 16%.\n•\nSearch and news advertising revenue excluding traffic acquisition costs increased 20%.\nIndustry Trends and Opportunities\nOur industry is dynamic and highly competitive, with frequent changes in both technologies and business models. Each industry shift is an \nopportunity to conceive new products, new technologies, or new ideas that can further transform the industry and our business. At Microsoft, \nwe push the boundaries of what is possible through a broad range of research and development activities that seek to identify and address. SUMMARY RESULTS OF OPERATIONS\n \n(In millions, except percentages and per share amounts)\n \n2025   \n2024   \nPercentage\nChange  \n \n \n \n \n \n \n \n \n \n \n \n \n \n \n \n \n \n \n \n \nRevenue\n $\n281,724  $\n245,122    \n15%  \nGross margin\n  \n193,893   \n171,008    \n13%  \nOperating income\n  \n128,528   \n109,433    \n17%  \nNet income\n  \n101,832   \n88,136    \n16%  \nDiluted earnings per share\n  \n13.64   \n11.80    \n16%  \n \n \n \n  \n \n \n \n \n \n \n \n \n \n \n \n \n \n \n \n \n \n \n \n \n \n \nFiscal Year 2025 Compared with Fiscal Year 2024\nRevenue increased $36.6 billion or 15% with growth across each of our segments. Intelligent Cloud revenue increased driven by Azure. \nProductivity and Business Processes revenue increased driven by Microsoft 365 Commercial cloud. More Personal Computing revenue \nincreased driven by Gaming and Search and news advertising.\nCost of revenue increased $13.7 billion or 19% driven by growth in Microsoft Cloud.\nGross margin increased $22.9 billion or 13% with growth across each of our segments. \n•. supporting an array of software products; delivering relevant online advertising to a global audience; and designing and selling devices. Our \nmost significant expenses are related to compensating employees; supporting and investing in our cloud-based services, including \ndatacenter operations; designing, manufacturing, marketing, and selling our other products and services; and income taxes.\nHighlights from fiscal year 2025 compared with fiscal year 2024 included:\n•\nMicrosoft Cloud revenue increased 23% to $168.9 billion.\n•\nMicrosoft 365 Commercial products and cloud services revenue increased 14% driven by Microsoft 365 Commercial cloud \nrevenue growth of 15%.\n•\nMicrosoft 365 Consumer products and cloud services revenue increased 11% driven by Microsoft 365 Consumer cloud revenue \ngrowth of 11%.\n•\nLinkedIn revenue increased 9%.\n•\nDynamics products and cloud services revenue increased 15% driven by Dynamics 365 revenue growth of 19%.\n•. Cost of revenue increased $13.7 billion or 19% driven by growth in Microsoft Cloud.\nGross margin increased $22.9 billion or 13% with growth across each of our segments. \n•\nGross margin percentage decreased slightly driven by Intelligent Cloud, offset in part by More Personal Computing.\n•\nMicrosoft Cloud gross margin percentage decreased to 69% driven by the impact of scaling our AI infrastructure, offset in part \nby efficiency gains in Azure.\nOperating expenses increased $3.8 billion or 6% driven by investments in cloud and AI engineering and Gaming, including the impact of the \nActivision Blizzard acquisition.\nOperating income increased $19.1 billion or 17% with growth across each of our segments.",
        "answer": "Dynamics revenue is driven by growth in Dynamics 365, which saw a revenue growth of 19%.",
        "context_adherence": "1.0",
        "context_precision": "0.8",
        "answer_relevance": "0.674",
        "groundedness": "{\n    \"score\": 1.0,\n    \"unsupported_claims\": [],\n    \"reason\": \"The claim about Dynamics revenue being driven by growth in Dynamics 365 with a revenue growth of 19% is directly supported by the context.\"\n}"
    },
    {
        "UseCase_id": "UC:1",
        "QNo": 19,
        "question": "What factors impact Windows OEM revenue?",
        "context": "•\nSearch and news advertising, comprising Bing and Copilot, Microsoft News, Microsoft Edge, and third-party affiliates.\nWindows and Devices\nThe Windows operating system is designed to deliver a more personal computing experience for users by enabling consistency of \nexperience, applications, and information across their devices. Windows OEM revenue is impacted significantly by the number of Windows \noperating system licenses purchased by OEMs, which they pre-install on the devices they sell. In addition to computing device market \nvolume, Windows OEM revenue is impacted by: \n•\nThe mix of computing devices based on form factor and screen size.\n•\nDifferences in device market demand between developed markets and growth markets.\n•\nGrowth of the AI PC category.\n•\nAttachment of Windows to devices shipped.\n•\nCustomer mix between consumer, small and medium businesses, and large enterprises.\n•\nChanges in inventory levels in the OEM channel.\n•. PART II\nItem 7\n \n38\nMore Personal Computing\nMetrics related to our More Personal Computing segment assess the performance of our key consumer businesses.\n \nWindows OEM and Devices revenue growth\n \nRevenue from sales of Windows Pro and non-Pro licenses sold through the OEM \nchannel and sales of first-party Devices, including Surface and PC accessories\n \n \n \nXbox content and services revenue growth \n \nRevenue from Xbox content and services, comprising first- and third-party content \n(including games and in-game content), Xbox Game Pass and other subscriptions, \nXbox Cloud Gaming, advertising, and other cloud services\n \n \n \nSearch and news advertising revenue (ex TAC) \ngrowth\n \nRevenue from search and news advertising excluding traffic acquisition costs \n(“TAC”) paid to Bing Ads network publishers and news partners\nSUMMARY RESULTS OF OPERATIONS\n \n(In millions, except percentages and per share amounts)\n \n2025   \n2024   \nPercentage\nChange  \n \n \n \n \n \n \n \n \n \n \n \n \n \n \n \n \n \n \n \n \nRevenue\n $. PART I\nItem 1\n \n12\nOEMs \nWe distribute our products and services through OEMs that pre-install our software on new devices and servers they sell. The largest \ncomponent of the OEM business is the Windows operating system pre-installed on devices. OEMs also sell devices pre-installed with other \nMicrosoft products and services, including applications such as Office and the capability to subscribe to Microsoft 365 Consumer. \nThere are two broad categories of OEMs. The largest category of OEMs are direct OEMs as our relationship with them is managed through a \ndirect agreement between Microsoft and the OEM. We have distribution agreements covering one or more of our products with virtually all \nthe multinational OEMs, including Dell, Hewlett-Packard, Lenovo, and with many regional and local OEMs. The second broad category of \nOEMs are system builders consisting of lower-volume PC manufacturers, which source Microsoft software for pre-installation and local. advertising solutions. In addition to first-party tools, we have several partnerships with companies through which we provide and monetize \nsearch offerings. Growth depends on our ability to attract new users, understand intent, and match intent with relevant content on advertising \nofferings.\nCompetition \nWindows faces competition from various software products and from alternative platforms and devices. We believe Windows competes \neffectively by giving customers choice, value, flexibility, security, an easy-to-use interface, and compatibility with a broad range of hardware \nand software applications, including those that enable productivity. \nDevices face competition from various computer, tablet, and hardware manufacturers who offer a unique combination of high-quality \nindustrial design and innovative technologies across various price points. Many of these manufacturers are also current or potential partners \nand customers, including our Windows OEMs.. •\nAttachment of Windows to devices shipped.\n•\nCustomer mix between consumer, small and medium businesses, and large enterprises.\n•\nChanges in inventory levels in the OEM channel.\n•\nPricing changes and promotions, pricing variation that occurs when the mix of devices manufactured shifts from local and \nregional system builders to large multinational OEMs, and different pricing of Windows versions licensed.\n•\nConstraints in the supply chain of device components.\n•\nPiracy.\nWe design and sell devices, such as Surface (including Copilot+ PCs) and PC accessories. Our devices are designed to enable people and \norganizations to connect to the people and content that matter most using Windows and integrated Microsoft products and services. Surface \nis designed to help organizations, students, and consumers be more productive. Growth in Devices is dependent on total PC shipments, the \nability to attract new customers, our product roadmap, and expanding into new categories.",
        "answer": "The factors that impact Windows OEM revenue include:\n\n1. The number of Windows operating system licenses purchased by OEMs.\n2. The mix of computing devices based on form factor and screen size.\n3. Differences in device market demand between developed markets and growth markets.\n4. Growth of the AI PC category.\n5. Attachment of Windows to devices shipped.\n6. Customer mix between consumer, small and medium businesses, and large enterprises.\n7. Changes in inventory levels in the OEM channel.\n8. Pricing changes and promotions.\n9. Pricing variation that occurs when the mix of devices manufactured shifts from local and regional system builders to large multinational OEMs.\n10. Constraints in the supply chain of device components.\n11. Piracy.",
        "context_adherence": "1.0",
        "context_precision": "0.8",
        "answer_relevance": "0.880",
        "groundedness": "{\n    \"score\": 1.0,\n    \"unsupported_claims\": [],\n    \"reason\": \"All claims made in the answer are directly supported by the context provided.\"\n}"
    },
    {
        "UseCase_id": "UC:1",
        "QNo": 20,
        "question": "What are the six pillars of the AWS Well-Architected Framework?",
        "context": "AWS Well-Architected Framework\nFramework\nFurther reading\nAWS Architecture Center\nAWS Cloud Compliance\nAWS Well-Architected Partner program\nAWS Well-Architected Tool\nAWS Well-Architected homepage\nOperational Excellence Pillar whitepaper\nSecurity Pillar whitepaper\nReliability Pillar whitepaper\nPerformance Eﬃciency Pillar whitepaper\nCost Optimization Pillar whitepaper\nSustainability Pillar whitepaper\nThe Amazon Builders' Library\n68. reliability, performance eﬃciency, cost optimization, and sustainability.\nTable 1. The pillars of the AWS Well-Architected Framework\nName\nDescription\nOperational excellence\nThe ability to support development and run \nworkloads eﬀectively, gain insight into their \noperations, and to continuously improve \nsupporting processes and procedures to \ndeliver business value.\nSecurity\nThe security pillar describes how to take \nadvantage of cloud technologies to protect \nDeﬁnitions\n2. AWS Well-Architected Framework\nFramework\nConclusion\nThe AWS Well-Architected Framework provides architectural best practices across the six pillars for \ndesigning and operating reliable, secure, eﬃcient, cost-eﬀective, and sustainable systems in the \ncloud. The Framework provides a set of questions that allows you to review an existing or proposed \narchitecture. It also provides a set of AWS best practices for each pillar. Using the Framework in \nyour architecture will help you produce stable and eﬃcient systems, which allow you to focus on \nyour functional requirements.\n66. knowledge, and can help you review and improve your workloads.\nDeﬁnitions\nEvery day, experts at AWS assist customers in architecting systems to take advantage of best \npractices in the cloud. We work with you on making architectural trade-oﬀs as your designs evolve. \nAs you deploy these systems into live environments, we learn how well these systems perform and \nthe consequences of those trade-oﬀs.\nBased on what we have learned, we have created the AWS Well-Architected Framework, which \nprovides a consistent set of best practices for customers and partners to evaluate architectures, \nand provides a set of questions you can use to evaluate how well an architecture is aligned to AWS \nbest practices.\nThe AWS Well-Architected Framework is based on six pillars — operational excellence, security, \nreliability, performance eﬃciency, cost optimization, and sustainability.\nTable 1. The pillars of the AWS Well-Architected Framework\nName\nDescription\nOperational excellence. The AWS Well-Architected Framework documents a set of foundational questions that help you to \nunderstand if a speciﬁc architecture aligns well with cloud best practices. The framework provides \na consistent approach to evaluating systems against the qualities you expect from modern cloud-\nbased systems, and the remediation that would be required to achieve those qualities. As AWS \ncontinues to evolve, and we continue to learn more from working with our customers, we will \ncontinue to reﬁne the deﬁnition of well-architected.\nThis framework is intended for those in technology roles, such as chief technology oﬃcers \n(CTOs), architects, developers, and operations team members. It describes AWS best practices and \nstrategies to use when designing and operating a cloud workload, and provides links to further \nimplementation details and architectural patterns. For more information, see the AWS Well-\nArchitected homepage.\nIntroduction\n1",
        "answer": "The six pillars of the AWS Well-Architected Framework are operational excellence, security, reliability, performance efficiency, cost optimization, and sustainability.",
        "context_adherence": "1.0",
        "context_precision": "0.8",
        "answer_relevance": "0.905",
        "groundedness": "{\n    \"score\": 1.0,\n    \"unsupported_claims\": [],\n    \"reason\": \"All claims in the answer are directly supported by the context.\"\n}"
    },
    {
        "UseCase_id": "UC:1",
        "QNo": 21,
        "question": "What are the design principles of the Operational Excellence pillar?",
        "context": "• Security\n• Reliability\n• Performance eﬃciency\n• Cost optimization\n• Sustainability\nOperational excellence\nOperational excellence (OE) is a commitment to build software correctly while consistently \ndelivering a great customer experience. The operational excellence pillar contains best practices for \norganizing your team, designing your workload, operating it at scale, and evolving it over time.\nThe operational excellence pillar provides an overview of design principles, best practices, and \nquestions. You can ﬁnd prescriptive guidance on implementation in the Operational Excellence \nPillar whitepaper.\nTopics\n• Design principles\n• Deﬁnition\n• Best practices\n• Resources\nOperational excellence\n8. AWS Well-Architected Framework\nFramework\nAppendix: Questions and best practices\nThis appendix summarizes all the questions and best practices in the AWS Well-Architected \nFramework.\nPillars\n• Operational excellence\n• Security\n• Reliability\n• Performance eﬃciency\n• Cost optimization\n• Sustainability\nOperational excellence\nOperational excellence (OE) is a commitment to build software correctly while consistently \ndelivering a great customer experience. The operational excellence pillar contains best practices for \norganizing your team, designing your workload, operating it at scale, and evolving it over time. You \ncan ﬁnd prescriptive guidance on implementation in the Operational Excellence Pillar whitepaper.\nBest practice areas\n• Organization\n• Prepare\n• Operate\n• Evolve\nOrganization\nQuestions\n• OPS 1. How do you determine what your priorities are?\n• OPS 2. How do you structure your organization to support your business outcomes?. questions. You can ﬁnd prescriptive guidance on implementation in the Performance Eﬃciency \nPillar whitepaper.\nTopics\n• Design principles\n• Deﬁnition\n• Best practices\n• Resources\nResources\n39. The pillars of the framework ......................................................................................................... 8\nOperational excellence ................................................................................................................................ 8\nDesign principles ..................................................................................................................................... 9\nDeﬁnition ................................................................................................................................................ 10\nBest practices ......................................................................................................................................... 11\nResources ................................................................................................................................................ 20. AWS Well-Architected Framework\nFramework\nThe pillars of the framework\nCreating a software system is a lot like constructing a building. If the foundation is not solid, \nstructural problems can undermine the integrity and function of the building. When architecting \ntechnology solutions, if you neglect the six pillars of operational excellence, security, reliability, \nperformance eﬃciency, cost optimization, and sustainability, it can become challenging to build a \nsystem that delivers on your expectations and requirements. Incorporating these pillars into your \narchitecture will help you produce stable and eﬃcient systems. This will allow you to focus on the \nother aspects of design, such as functional requirements.\nPillars\n• Operational excellence\n• Security\n• Reliability\n• Performance eﬃciency\n• Cost optimization\n• Sustainability\nOperational excellence\nOperational excellence (OE) is a commitment to build software correctly while consistently",
        "answer": "I don't know.",
        "context_adherence": "0.0",
        "context_precision": "0.8",
        "answer_relevance": "0.156",
        "groundedness": "{\n    \"score\": 0.0,\n    \"unsupported_claims\": [],\n    \"reason\": \"The answer does not provide any factual claims that can be traced back to the context.\"\n}"
    }
]